Post Title,Post Time
Biggest raised you’ve asked for and/or received?,2023-11-26 11:38:52
I need to ask questions for people who work for the UN or EU,2023-11-26 11:19:31
Job/life crisis,2023-11-26 11:10:07
How to get a job as an ACCA student?,2023-11-26 10:30:26
Is It Like This Everywhere right now?,2023-11-26 10:13:33
Been applying and no luck at all,2023-11-26 10:01:20
At your employer can a manager fire an employee without on a whim?,2023-11-26 09:43:11
I Have a job's existential crisis,2023-11-26 09:35:43
Contractor doing unpaid “Ghost” Hours,2023-11-26 09:17:21
Looking For Part-time Jobs,2023-11-26 08:54:09
Questions about the job market for fresh graduates: need help with my personal case.,2023-11-26 08:29:02
Advice on the current position,2023-11-26 08:18:57
Are there real WFH jobs that you can attain?,2023-11-26 08:16:00
"Cannot find any job, even applying to Walmart and such outside of my ""field""",2023-11-26 08:12:09
Would you commute 3 hours a day to your work for a good pay? Or is there a limit to how much you'd commute for work regardless of the pay,2023-11-26 08:10:25
"Just looked at job posting for new employees that I will supervise, and their salary will be higher than mine",2023-11-26 08:01:20
An Entrepreneur in the Stationary Business,2023-11-26 07:59:41
"What are good jobs to have to kill time, while trying to figure out a career you’d like in the future?",2023-11-26 07:26:04
Employers who talk out of both sides of their mouth,2023-11-26 07:16:30
Laid off - Should I add a three months experience onto my resume? Next Steps,2023-11-26 06:49:47
Driving jobs?,2023-11-26 06:30:08
Is a conditional offer a good sign?,2023-11-26 06:18:47
Tell me what job I should do for as a career,2023-11-26 06:03:02
Can I quit my job over text?,2023-11-26 06:00:28
Keeping track of all the jobs I applied to starting in October to show how shit this job market is,2023-11-26 05:46:55
"Please, are there any LEGIT work-from-home job opportunities??",2023-11-26 05:34:14
Need a job to fit my personality,2023-11-26 05:27:40
For anyone who works at raising canes what does it mean when you get a conditional offer? does it mean I got the job?,2023-11-26 05:19:44
Is anyone else finding it super difficult to get a job now ?,2023-11-26 05:03:05
Job listed as remote work on one older post on another site says remote but living in certain state,2023-11-26 04:56:04
Any Fashion buyers here?,2023-11-26 04:50:19
Hiring my manager - what to ask/how to interview?,2023-11-26 04:34:36
"Unspoken-About, Underground Jobs!",2023-11-26 04:24:51
I do not know what I am doing wrong here,2023-11-26 04:24:06
Tough market,2023-11-26 04:15:36
No job fam yell daily basis,2023-11-26 04:01:58
Group Interview for Stock Associate at a UGG store :[,2023-11-26 03:59:12
Successful and Hate my job. Semi-directionless,2023-11-26 03:58:44
Job Hunting Sucks,2023-11-26 03:26:03
Hit a wall. where to go from here? Job ideas?,2023-11-26 03:26:00
Job Interview,2023-11-26 02:35:26
"Wanting to spice up my resume, planning on applying for an internship or apprenticeship",2023-11-26 02:03:44
DudePivot47 hates cool world (1992),2023-11-26 01:46:46
Amazon locker and customer service associate,2023-11-26 01:44:43
(Social Person) good carrers,2023-11-26 01:14:29
Where is the best place to look for an entry level wfh job,2023-11-26 01:05:17
my job is killing me,2023-11-26 01:03:23
How can I say no to unlimited coffee,2023-11-26 00:52:59
Programmer feeling like a zombie lately,2023-11-26 00:38:13
Is this a subtle way to reject someone?,2023-11-26 00:36:47
