Post Title,Post Time
To put in a 2 weeks or not…,2023-11-26 17:36:45
When to update LinkedIn after getting new job?,2023-11-26 17:31:52
JOB IN ABUDHABI BAKER,2023-11-26 17:29:54
Entry-Level Jobs that Aren't the Food Industry?,2023-11-26 17:23:52
How to Stop my Work Dreams from Waking me Up and Giving me Headaches?,2023-11-26 17:15:29
[USA][MA] Performance Improvement Plan - Quit? Need guidance,2023-11-26 16:48:18
Is insurance sales worth looking into?,2023-11-26 16:42:04
I AM LOOKING FOR A BA ANAYLST FOR MY TEAM,2023-11-26 16:38:11
Finance planning for an internship,2023-11-26 16:22:22
Easy Remote Work,2023-11-26 16:15:49
How to Professionally Say Something after a $10k/yr Paycut,2023-11-26 16:13:54
Job advice,2023-11-26 15:44:29
Got laid off from first post grad job,2023-11-26 15:37:50
"For those of you who found a job in this crazy job market , what was your strategy?",2023-11-26 15:21:52
Looking for a job in madiclaim field ( cashless ),2023-11-26 15:19:54
What are the best paid jobs in USA or Canada for old or newcomers?,2023-11-26 15:18:23
I was fired and my company reach out to me the next day through indeed?,2023-11-26 15:06:39
Job for almost 60 year old mother,2023-11-26 14:56:44
Do I leave my job?,2023-11-26 14:41:47
Can you accept and then back out of a job offer?,2023-11-26 14:26:25
Idk what to do anymore. am I screwed?,2023-11-26 14:11:45
Want help to find where to study,2023-11-26 14:10:40
Re-posted jobs that you've already applied for,2023-11-26 14:09:29
Red flags for a bad workplace environment?,2023-11-26 13:29:09
How did you get your Graduate Jobs,2023-11-26 13:00:24
My dream Job Characteristics - India,2023-11-26 12:53:20
Relatable.,2023-11-26 12:50:57
Can anyone shed some light on WHY its so hard to find a job these days?,2023-11-26 11:50:39
Biggest raised you’ve asked for and/or received?,2023-11-26 11:38:52
I need to ask questions for people who work for the UN or EU,2023-11-26 11:19:31
Job/life crisis,2023-11-26 11:10:07
How to get a job as an ACCA student?,2023-11-26 10:30:26
Is It Like This Everywhere right now?,2023-11-26 10:13:33
Been applying and no luck at all,2023-11-26 10:01:20
At your employer can a manager fire an employee without on a whim?,2023-11-26 09:43:11
I Have a job's existential crisis,2023-11-26 09:35:43
Contractor doing unpaid “Ghost” Hours,2023-11-26 09:17:21
Questions about the job market for fresh graduates: need help with my personal case.,2023-11-26 08:29:02
Advice on the current position,2023-11-26 08:18:57
Are there real WFH jobs that you can attain?,2023-11-26 08:16:00
"Cannot find any job, even applying to Walmart and such outside of my ""field""",2023-11-26 08:12:09
Would you commute 3 hours a day to your work for a good pay? Or is there a limit to how much you'd commute for work regardless of the pay,2023-11-26 08:10:25
"Just looked at job posting for new employees that I will supervise, and their salary will be higher than mine",2023-11-26 08:01:20
An Entrepreneur in the Stationary Business,2023-11-26 07:59:41
"What are good jobs to have to kill time, while trying to figure out a career you’d like in the future?",2023-11-26 07:26:04
Employers who talk out of both sides of their mouth,2023-11-26 07:16:30
Laid off - Should I add a three months experience onto my resume? Next Steps,2023-11-26 06:49:47
Driving jobs?,2023-11-26 06:30:08
Is a conditional offer a good sign?,2023-11-26 06:18:47
Tell me what job I should do for as a career,2023-11-26 06:03:02
