Post Title,Post Time
"Linux users, I created a script to automatically install oh-my-zsh, conda, gpu drivers, cuda and more",2023-11-25 00:50:59
Saturday Daily Thread: Resource Request and Sharing! Daily Thread,2023-11-25 00:00:23
"My first actual project ""Skin Alert"", which monitors Counter Strike 2 marketplaces for discounted skins",2023-11-24 20:56:05
Large Scale LinkedIn Job Scraper,2023-11-24 19:45:20
GraphQL AI for devs,2023-11-24 19:44:00
YouTube Q&A System,2023-11-24 04:56:31
Introducing my project for running multiple commands in Google Colab,2023-11-24 13:54:21
simple-html 1.0.0 -- fast html rendering for people that don't like templates,2023-11-24 18:26:13
Why not?,2023-11-24 15:42:26
Python Black Friday,2023-11-24 14:32:50
