Post Title,Post Time
Keeping internship/university experience on resume at 23?,2023-11-25 15:29:09
Non-IT Job market in New Zealand?,2023-11-25 15:23:57
Overwhelmed with emotion upon receiving a significant income increase.,2023-11-25 14:56:20
Am I making a huge mistake?,2023-11-25 14:45:08
Tips for websites that offer remote work internationally?,2023-11-25 14:22:06
AC at work has been broken for a year + some (FL),2023-11-25 14:17:46
Thank you so much everyone,2023-11-25 14:00:56
Student placements are so freaking hard to find!,2023-11-25 13:57:53
"In this scenario, is it inappropriate to ask for a draw on commission?",2023-11-25 13:23:38
Kuya J's PH Working Environment,2023-11-25 13:19:10
How to find a job after college?,2023-11-25 13:13:50
Pre-engagement Checks for Australian Gov Jobs,2023-11-25 13:01:17
Pre-Engagement Check for Australian Gov Job,2023-11-25 12:59:29
How to ace second interview?,2023-11-25 12:48:02
Does anyone have any tips to get into software engineering ring in the UK?,2023-11-25 11:30:09
Can I apply for graduate program?,2023-11-25 10:57:19
Do you guys send a thank you email after an interview? And what do you say?,2023-11-25 10:56:30
I’ve been interviewing for a position close to a month now,2023-11-25 10:55:09
Job related if hospitality background ?,2023-11-25 10:52:35
what are some easy qualifications you can get that can benefit your CV?,2023-11-25 10:50:56
Is a Professional Career Counselor Worth it?,2023-11-25 10:22:15
Need help finding a career path,2023-11-25 10:11:29
where is the money going?,2023-11-25 09:32:16
I quit my job and my piece of shit boss.,2023-11-25 09:20:07
Need advice,2023-11-25 08:11:56
Job-Oriented Professional Courses After 12th,2023-11-25 07:49:45
I shouldn’t be complaining right?,2023-11-25 07:46:03
Any job suggestions for a school leaver?,2023-11-25 07:44:57
"Having trouble at work, please help!",2023-11-25 07:17:52
Tips for getting a retail / fast food job?,2023-11-25 07:17:10
X ray tech boot camps or programs?,2023-11-25 06:56:53
"finding a new job, full time college student",2023-11-25 06:45:13
How much time can it take for a company to send the offer letter after submitting my documents for verification?,2023-11-25 06:39:44
Interview help for the frontend developer job!,2023-11-25 06:25:46
Going for a promotion or the reputation of a company?,2023-11-25 05:10:55
Question: How do I quite? (USPS Holiday Clerk),2023-11-25 04:47:57
Should I sign this contract?,2023-11-25 04:42:20
What’s the best way to pick up freelance gigs?,2023-11-25 04:32:27
Red Flag in a job offer . Pondering to accept the offer or look for something else?,2023-11-25 04:32:24
Great jobs for lazy people?,2023-11-25 04:27:02
First job might be at a sex shop. Is this a bad decision?,2023-11-25 04:25:23
Trying to get out of NYC restaurant work,2023-11-25 04:15:59
I need to get hired urgently. Please read and help.,2023-11-25 04:15:40
How do I get my first job without experience or friends?,2023-11-25 04:03:52
Another month without a job,2023-11-25 03:53:35
What careers are you guys in after college? And what path did you take?,2023-11-25 03:45:07
Former Employer Put I Was Terminated But I Gave a Four Week Notice?,2023-11-25 03:28:14
I found out the job I got was limited service. What can I expect?,2023-11-25 03:27:57
"Been unemployed for just over a year now, looking for advice",2023-11-25 03:25:56
Looking for part time job,2023-11-25 03:06:18
